{
  "schema_kind": "odd_world_model.source_observation",
  "schema_version": "v1",
  "observation_ref": "source-observation://odd_world_model/sandbox/apra_liquidity_model/v1",
  "source": {
    "ref": "source-corpus://odd_world_model/apra_liquidity_model/v1",
    "digest": "sha256:49d400eee2db46df6cdeff41f465e2487b8a1a4817b58ba128f7c40525bf83c1",
    "version": "v1"
  },
  "source_kind": "json_domain_and_regulatory_evidence",
  "authority_ref": "authority://odd_world_model/apra-liquidity-example/v1",
  "evidence_refs": [
    "source-file://apra_liquidity_model/data/authority/apra_liquidity_faq.html#sha256:6fac30f6fa0759dc034e6945f4eeb757405cf69fed35d7ecdcf222fdc31228c0",
    "source-file://apra_liquidity_model/data/authority/apra_liquidity_landing_page.html#sha256:8a86590e8875f3b73f0ada79ab4b8548003e23f913108354ef3cd106b641bc15",
    "source-file://apra_liquidity_model/data/authority/aps_210_liquidity_2025.html#sha256:384ae122214556977402aad8fe5714203b2b7b1d2321e3ab2e46f84cc69751de",
    "source-file://apra_liquidity_model/data/authority/ars_210_0_liquidity_2023.html#sha256:e7e1b60b1f7f417dac38fc6209914953059b0a9799fdaf35debf1a022223f245",
    "source-file://apra_liquidity_model/data/authority_claims.json#sha256:a64f924fa2529a103f0c94222c63cc08f0cff0aa015381ce2b854a5028804094",
    "source-file://apra_liquidity_model/data/domain_input.json#sha256:3f077fd045da38d57b9b5d41ea509f1584319b8e34980d9e82cc8d8125274bc8",
    "source-file://apra_liquidity_model/data/requirements_snapshot.json#sha256:750e8673dad4de260944eb10c085cb5010970b8d478f0122c55d44021ab210d6",
    "source-file://apra_liquidity_model/pdfs/apg_210_liquidity_2025.pdf#sha256:ac9b334e1853cc66d8f6a3e8785ef1d66260c06a21deefaba7432f61899272d3",
    "source-file://apra_liquidity_model/uri_ledger/source_authority.md#sha256:7a14577e72c438c12b51f5d99d2ea2d247bacd0503346f17c3201c3c34179d8c",
    "source-file://apra_liquidity_model/uri_ledger/source_notes.md#sha256:6c75a67dcbb091f46cfa65ef4df909075e2fa62514f38eff069822944cc0e409"
  ],
  "observed_at": "2026-07-12T14:28:27.645Z",
  "observation_digest": "sha256:d633dfcec359ec5b8c886114548f118dd4de26280f09ee08adb86ad8a30a4caf"
}
